{
  "fleet_config_path": "/config/fleet.yaml",
  "map_path": "/config/map/map.yaml",
  "nav2_template_path": "/config/simulation-c2-3-params.template.yaml",
  "executor_duplicate_record_capacity": 32,
  "sensor": {
    "pose": [0.0, 0.0, 0.15, 0.0, 0.0, 0.0],
    "samples": 180,
    "min_angle_rad": -3.14159265359,
    "max_angle_rad": 3.14159265359,
    "min_range_m": 0.1,
    "max_range_m": 10.0,
    "resolution_m": 0.01,
    "update_rate_hz": 5.0
  },
  "room": {
    "size_m": [10.0, 10.0],
    "wall_thickness_m": 0.2,
    "wall_height_m": 1.0
  }
}
